{
  "schema": "kml.compounds.lesson.v1",
  "lesson": 106,
  "title": "Lesson 106 — Compounds",
  "grammar": {
    "position": 106,
    "lessonCount": 153,
    "progress": 0.693,
    "band": "late-middle",
    "progression": "grammar_progression.json"
  },
  "background": {
    "image": "assets/studies/chrysanthemum.jpg",
    "alt": "Chrysanthemums in Japan",
    "source": "kml/assets/studies/chrysanthemum.jpg",
    "collection": "Ambient Gallery Japan — Four Seasons"
  },
  "characters": [
    {
      "kanji": "媛",
      "readings": "エン・ひめ",
      "keyword": "maiden",
      "compounds": [
        {
          "id": "l106_愛媛",
          "surface": "愛媛",
          "reading": "えひめ",
          "meaning": "Ehime",
          "sourceGloss": "Ehime",
          "example": {
            "ja": "愛媛の柑橘が、港に荷揚げされました。",
            "en": "Ehime citrus was unloaded at the harbor.",
            "segments": [
              {
                "text": "愛媛",
                "reading": "えひめ"
              },
              {
                "text": "の"
              },
              {
                "text": "柑橘",
                "reading": "かんきつ"
              },
              {
                "text": "が、"
              },
              {
                "text": "港",
                "reading": "みなと"
              },
              {
                "text": "に"
              },
              {
                "text": "荷揚",
                "reading": "にあ"
              },
              {
                "text": "げされました。"
              }
            ]
          },
          "kind": "name"
        },
        {
          "id": "l106_才媛",
          "surface": "才媛",
          "reading": "さいえん",
          "meaning": "accomplished woman",
          "sourceGloss": "accomplished woman",
          "example": {
            "ja": "藩校には、詩文に優れた才媛がいました。",
            "en": "The domain school had an accomplished woman skilled in verse.",
            "segments": [
              {
                "text": "藩校",
                "reading": "はんこう"
              },
              {
                "text": "には、"
              },
              {
                "text": "詩文",
                "reading": "しぶん"
              },
              {
                "text": "に"
              },
              {
                "text": "優",
                "reading": "すぐ"
              },
              {
                "text": "れた"
              },
              {
                "text": "才媛",
                "reading": "さいえん"
              },
              {
                "text": "がいました。"
              }
            ]
          },
          "qa": {
            "migrationNote": "Literary vocabulary retained."
          }
        }
      ]
    },
    {
      "kanji": "援",
      "readings": "エン",
      "keyword": "abet",
      "compounds": [
        {
          "id": "l106_援助",
          "surface": "援助",
          "reading": "えんじょ",
          "meaning": "aid",
          "sourceGloss": "aid",
          "example": {
            "ja": "遭難のあとは、近隣の援助で船を直しました。",
            "en": "After the accident, neighboring help repaired the boat.",
            "segments": [
              {
                "text": "遭難",
                "reading": "そうなん"
              },
              {
                "text": "のあとは、"
              },
              {
                "text": "近隣",
                "reading": "きんりん"
              },
              {
                "text": "の"
              },
              {
                "text": "援助",
                "reading": "えんじょ"
              },
              {
                "text": "で"
              },
              {
                "text": "船",
                "reading": "ふね"
              },
              {
                "text": "を"
              },
              {
                "text": "直",
                "reading": "なお"
              },
              {
                "text": "しました。"
              }
            ]
          }
        },
        {
          "id": "l106_支援",
          "surface": "支援",
          "reading": "しえん",
          "meaning": "support",
          "sourceGloss": "support",
          "example": {
            "ja": "燃料の支援が途絶えると、出漁が止まります。",
            "en": "If fuel support stops, the boats stay in.",
            "segments": [
              {
                "text": "燃料",
                "reading": "ねんりょう"
              },
              {
                "text": "の"
              },
              {
                "text": "支援",
                "reading": "しえん"
              },
              {
                "text": "が"
              },
              {
                "text": "途絶",
                "reading": "とだ"
              },
              {
                "text": "えると、"
              },
              {
                "text": "出漁",
                "reading": "しゅつぎょ"
              },
              {
                "text": "が"
              },
              {
                "text": "止",
                "reading": "と"
              },
              {
                "text": "まります。"
              }
            ]
          }
        },
        {
          "id": "l106_応援",
          "surface": "応援",
          "reading": "おうえん",
          "meaning": "cheering, backing",
          "sourceGloss": "cheering, backing",
          "example": {
            "ja": "岸の応援が、漕ぎのリズムを整えました。",
            "en": "Cheering from shore set the rowing rhythm.",
            "segments": [
              {
                "text": "岸",
                "reading": "きし"
              },
              {
                "text": "の"
              },
              {
                "text": "応援",
                "reading": "おうえん"
              },
              {
                "text": "が、"
              },
              {
                "text": "漕",
                "reading": "こ"
              },
              {
                "text": "ぎのリズムを"
              },
              {
                "text": "整",
                "reading": "ととの"
              },
              {
                "text": "えました。"
              }
            ]
          }
        }
      ]
    },
    {
      "kanji": "緩",
      "readings": "カン・ゆる-い",
      "keyword": "slacken",
      "compounds": [
        {
          "id": "l106_緩い",
          "surface": "緩い",
          "reading": "ゆるい",
          "meaning": "loose, slack",
          "sourceGloss": "loose, slack",
          "example": {
            "ja": "結びが緩いと、帆が落ちます。",
            "en": "If the knot is loose, the sail will fall.",
            "segments": [
              {
                "text": "結",
                "reading": "むす"
              },
              {
                "text": "びが"
              },
              {
                "text": "緩い",
                "reading": "ゆるい"
              },
              {
                "text": "と、"
              },
              {
                "text": "帆",
                "reading": "ほ"
              },
              {
                "text": "が"
              },
              {
                "text": "落",
                "reading": "お"
              },
              {
                "text": "ちます。"
              }
            ]
          }
        },
        {
          "id": "l106_緩和",
          "surface": "緩和",
          "reading": "かんわ",
          "meaning": "easing, relief",
          "sourceGloss": "easing, relief",
          "example": {
            "ja": "検査の緩和に伴って、出港が早くなりました。",
            "en": "With the easing of inspections, departures have gotten earlier.",
            "segments": [
              {
                "text": "検査",
                "reading": "けんさ"
              },
              {
                "text": "の"
              },
              {
                "text": "緩和",
                "reading": "かんわ"
              },
              {
                "text": "に"
              },
              {
                "text": "伴",
                "reading": "ともな"
              },
              {
                "text": "って、"
              },
              {
                "text": "出港",
                "reading": "しゅっこう"
              },
              {
                "text": "が"
              },
              {
                "text": "早",
                "reading": "はや"
              },
              {
                "text": "くなりました。"
              }
            ]
          }
        },
        {
          "id": "l106_緩む",
          "surface": "緩む",
          "reading": "ゆるむ",
          "meaning": "to loosen",
          "sourceGloss": "to loosen",
          "example": {
            "ja": "雨で土が緩んで、石垣が傾きました。",
            "en": "Rain loosened the soil, and the stone wall leaned.",
            "segments": [
              {
                "text": "雨",
                "reading": "あめ"
              },
              {
                "text": "で"
              },
              {
                "text": "土",
                "reading": "つち"
              },
              {
                "text": "が"
              },
              {
                "text": "緩",
                "reading": "ゆる"
              },
              {
                "text": "んで、"
              },
              {
                "text": "石垣",
                "reading": "いしがき"
              },
              {
                "text": "が"
              },
              {
                "text": "傾",
                "reading": "かたむ"
              },
              {
                "text": "きました。"
              }
            ]
          }
        }
      ]
    },
    {
      "kanji": "属",
      "readings": "ゾク・さかん",
      "keyword": "belong",
      "compounds": [
        {
          "id": "l106_属する",
          "surface": "属する",
          "reading": "ぞくする",
          "meaning": "to belong",
          "sourceGloss": "to belong",
          "example": {
            "ja": "この船団は、隣町の組合に属しています。",
            "en": "This fleet belongs to the next town's co-op.",
            "segments": [